{
  "schema_version": "1.0",
  "experiment_id": "asd_050_prompt_equivariance_quartet",
  "plan_sha256": "0e991042356e78fc082a9f9cd34e6428b0225a3367c7ae09267322d6a98d87ff",
  "plan_revision": 1,
  "revision": 0,
  "status": "blocked",
  "outcome": null,
  "phase": "initialization",
  "created_at": "2026-07-31T00:00:00Z",
  "updated_at": "2026-07-31T00:00:00Z",
  "current_stage_id": null,
  "executor": null,
  "lease": null,
  "last_event_seq": 1,
  "blockers": [
    {
      "code": "dependency_unsatisfied",
      "dependency_id": "asd_000_evidence_lock_error_atlas",
      "required_outcomes": ["go"],
      "message": "The locked lineage, prompt ontology, cohorts, and laterality error atlas are required.",
      "resolution": "Wait for ASD-000 to finish with outcome go."
    }
  ],
  "stages": [
    {"id": "implement_quartet_pipeline", "status": "pending", "attempts": 0, "started_at": null, "completed_at": null, "last_error": null, "evidence_refs": []},
    {"id": "validate_and_build_quartets", "status": "pending", "attempts": 0, "started_at": null, "completed_at": null, "last_error": null, "evidence_refs": []},
    {"id": "docker_gpu_preflight", "status": "pending", "attempts": 0, "started_at": null, "completed_at": null, "last_error": null, "evidence_refs": []},
    {"id": "baseline_quartet_audit", "status": "pending", "attempts": 0, "started_at": null, "completed_at": null, "last_error": null, "evidence_refs": []},
    {"id": "pilot_t2", "status": "pending", "attempts": 0, "started_at": null, "completed_at": null, "last_error": null, "evidence_refs": []},
    {"id": "decision_t3", "status": "pending", "attempts": 0, "started_at": null, "completed_at": null, "last_error": null, "evidence_refs": []},
    {"id": "confirm_t4", "status": "pending", "attempts": 0, "started_at": null, "completed_at": null, "last_error": null, "evidence_refs": []},
    {"id": "closeout", "status": "pending", "attempts": 0, "started_at": null, "completed_at": null, "last_error": null, "evidence_refs": []}
  ],
  "budget_consumed": {
    "gpu_hours": 0.0,
    "cpu_hours": 0.0,
    "storage_gib": 0.0
  },
  "verified_artifact_ids": ["experiment_plan", "protocol_config"],
  "artifacts_verified": false,
  "closeout_passed": false
}
