{
  "artifacts_verified": false,
  "blockers": [
    {
      "code": "dependency_unsatisfied",
      "message": "asd_000_evidence_lock_error_atlas: dependency status is ready",
      "stage_id": "implement_train_anatomy_pipeline"
    }
  ],
  "budget_consumed": {
    "cpu_hours": 0.0,
    "gpu_hours": 0.0,
    "storage_gib": 0.0
  },
  "closeout_passed": false,
  "created_at": "2026-07-31T00:00:00Z",
  "current_stage_id": null,
  "executor": null,
  "experiment_id": "asd_005_train_anatomy_asset_extension",
  "last_event_seq": 2,
  "lease": null,
  "obligation_projection": {
    "artifact_ids": [
      "anatomy_cache",
      "anatomy_manifest",
      "asd000_lineage",
      "cache_validation_report",
      "closeout_report",
      "fast_val200_reference",
      "generation_report",
      "human_summary",
      "metadata",
      "pipeline_cli",
      "pipeline_tests",
      "protocol_config",
      "qc_cases",
      "qc_summary",
      "smoke_output",
      "smoke_report",
      "source_manifest",
      "source_manifest_lock",
      "totalsegmentator_weights"
    ],
    "artifacts_sha256": "29e57b09a3f333bc9b1ebc1aa1b68d198b3c6fedf5d26dfe1adbad1381b81d2a",
    "claim_ids": [
      "anatomy_asset_has_expected_mechanism",
      "anatomy_asset_meets_operational_target",
      "deterministic_generation_causes_reproducible_asset",
      "source_geometry_preserved",
      "trainval_fast_anatomy_feasible"
    ],
    "claim_types": [
      "causal",
      "feasibility",
      "mechanistic",
      "performance",
      "safety"
    ],
    "claims_sha256": "6eea2a4ec12f79342ad42de5ef4574dab8796db8dfc544999650a8bcaae96aa9",
    "pinned_at": "2026-08-01T05:04:41.122398Z",
    "required_artifact_ids": [
      "anatomy_cache",
      "anatomy_manifest",
      "asd000_lineage",
      "cache_validation_report",
      "closeout_report",
      "fast_val200_reference",
      "generation_report",
      "human_summary",
      "metadata",
      "pipeline_cli",
      "pipeline_tests",
      "protocol_config",
      "qc_cases",
      "qc_summary",
      "smoke_output",
      "smoke_report",
      "source_manifest",
      "source_manifest_lock",
      "totalsegmentator_weights"
    ],
    "static_artifact_ids": [
      "fast_val200_reference",
      "metadata",
      "totalsegmentator_weights"
    ]
  },
  "outcome": null,
  "phase": "implement_train_anatomy_pipeline",
  "plan_history": [
    {
      "archived_artifacts_path": "experiments_aiselfdrive/.runtime/replans/asd_005_train_anatomy_asset_extension/revision_1_9a6170741b98/artifacts/manifest.json",
      "archived_claims_path": "experiments_aiselfdrive/.runtime/replans/asd_005_train_anatomy_asset_extension/revision_1_9a6170741b98/claims.yaml",
      "archived_plan_path": "experiments_aiselfdrive/.runtime/replans/asd_005_train_anatomy_asset_extension/revision_1_9a6170741b98/experiment.yaml",
      "archived_plan_sha256": "9a6170741b980641ee8948c8dae5c93a369fc3d72714044aa5f8a3b293dcc803",
      "archived_plan_size_bytes": 22752,
      "archived_result_path": "experiments_aiselfdrive/.runtime/replans/asd_005_train_anatomy_asset_extension/revision_1_9a6170741b98/result.json",
      "archived_result_sha256": "cf78485cbf18d5d90a5c3d0c9147a0bf02cec2e7c587457035a3b5d7c10d7e87",
      "archived_result_size_bytes": 448,
      "archived_state_path": "experiments_aiselfdrive/.runtime/replans/asd_005_train_anatomy_asset_extension/revision_1_9a6170741b98/state.json",
      "archived_state_sha256": "acc0a3c7449f06b6daf2a505ee705997fa6596a6957699400decac561e3674ac",
      "archived_state_size_bytes": 1675,
      "carried_budget_consumed": {
        "cpu_hours": 0.0,
        "gpu_hours": 0.0,
        "storage_gib": 0.0
      },
      "current_artifacts_sha256": "efbb26625b867456c20533a8e0f9a554e666516a1cf9d7c6a7cd104621c302ea",
      "current_claims_sha256": "ef181c88f5841b707d2b79fdf9585e41ef3217d464d14c6eee7635ea46cd1a90",
      "plan_revision": 1,
      "plan_sha256": "9a6170741b980641ee8948c8dae5c93a369fc3d72714044aa5f8a3b293dcc803",
      "previous_artifacts_sha256": "a81c4ae9a25d8024231d50a5aa6eb060ae920ec89309cdc83b82cc2be88c8755",
      "previous_artifacts_size_bytes": 2349,
      "previous_budget_consumed": {
        "cpu_hours": 0.0,
        "gpu_hours": 0.0,
        "storage_gib": 0.0
      },
      "previous_claims_sha256": "ddc9b21390b9e18dba22476da4a7be7b098c11d2cc7f99af18845acbddb01212",
      "previous_claims_size_bytes": 1153,
      "previous_plan_source": "git:827f962c3cfee117b6442b74653c752ed36f296c:experiments_aiselfdrive/experiments/asd_005_train_anatomy_asset_extension/experiment.yaml",
      "replanned_at": "2026-08-01T05:04:42.863205Z"
    }
  ],
  "plan_revision": 2,
  "plan_sha256": "098b8f7c55a3875f211bd76c157bad99fb7be2c8cc5d081286d52a1a98a298ad",
  "revision": 1,
  "schema_version": "1.0",
  "stages": [
    {
      "attempts": 0,
      "completed_at": null,
      "evidence_refs": [],
      "id": "implement_train_anatomy_pipeline",
      "last_error": null,
      "retry_not_before": null,
      "started_at": null,
      "status": "blocked"
    },
    {
      "attempts": 0,
      "completed_at": null,
      "evidence_refs": [],
      "id": "lock_trainval_source_manifest",
      "last_error": null,
      "retry_not_before": null,
      "started_at": null,
      "status": "pending"
    },
    {
      "attempts": 0,
      "completed_at": null,
      "evidence_refs": [],
      "id": "docker_preflight_and_one_case_smoke",
      "last_error": null,
      "retry_not_before": null,
      "started_at": null,
      "status": "pending"
    },
    {
      "attempts": 0,
      "completed_at": null,
      "evidence_refs": [],
      "id": "generate_four_shards",
      "last_error": null,
      "retry_not_before": null,
      "started_at": null,
      "status": "pending"
    },
    {
      "attempts": 0,
      "completed_at": null,
      "evidence_refs": [],
      "id": "validate_and_publish_anatomy_manifest",
      "last_error": null,
      "retry_not_before": null,
      "started_at": null,
      "status": "pending"
    },
    {
      "attempts": 0,
      "completed_at": null,
      "evidence_refs": [],
      "id": "closeout_anatomy_asset",
      "last_error": null,
      "retry_not_before": null,
      "started_at": null,
      "status": "pending"
    }
  ],
  "status": "blocked",
  "updated_at": "2026-08-01T05:04:42.863884Z",
  "verified_artifact_ids": [
    "fast_val200_reference",
    "metadata",
    "totalsegmentator_weights"
  ]
}
