{
  "artifacts_verified": false,
  "blockers": [
    {
      "code": "dependency_unsatisfied",
      "message": "asd_000_evidence_lock_error_atlas: dependency status is ready",
      "stage_id": "implement_persistence_set_pipeline"
    }
  ],
  "budget_consumed": {
    "cpu_hours": 0.0,
    "gpu_hours": 0.0,
    "storage_gib": 0.0
  },
  "closeout_passed": false,
  "created_at": "2026-07-31T00:00:00Z",
  "current_stage_id": null,
  "executor": null,
  "experiment_id": "asd_060_persistence_tree_set_verifier",
  "last_event_seq": 2,
  "lease": null,
  "obligation_projection": {
    "artifact_ids": [
      "asd010_artifact_manifest",
      "asd010_state",
      "asd020_artifact_manifest",
      "asd020_state",
      "asd030_artifact_manifest",
      "asd030_state",
      "asd040_artifact_manifest",
      "asd040_state",
      "branch_decision",
      "experiment_plan",
      "final_claims",
      "final_result",
      "final_summary",
      "frozen_feature_registry",
      "frozen_set_features",
      "gpu_preflight_report",
      "input_validation_report",
      "locked_lineage_manifest",
      "locked_parent_checkpoint",
      "oracle_report",
      "promotion_record",
      "protocol_config",
      "revision_2_logit_source_projection",
      "set_verifier_source_package",
      "set_verifier_test_suite",
      "t1_full_state_checkpoints",
      "t1_resume_report",
      "t2_checkpoints",
      "t2_metrics",
      "t3_checkpoints",
      "t3_metrics",
      "t4_matched_control_checkpoint",
      "t4_matched_control_metrics",
      "t4_metrics",
      "t4_set_checkpoint",
      "t4_set_metrics",
      "training_forest_manifest",
      "tri_state_policy_artifact",
      "val120_manifest",
      "val200_manifest",
      "val80_manifest",
      "val80_persistence_forest"
    ],
    "artifacts_sha256": "2ca5a3fd3cbb1f6982b3bd9f702fabc96be8ee0fd2b48a0f6a4ece05b27ae86a",
    "claim_ids": [
      "learned_verifier_recovers_oracle_gain",
      "persistence_candidates_have_headroom",
      "persistence_forest_oracle_is_feasible",
      "set_context_beats_independent_scoring",
      "verifier_replicates_on_internal_val120",
      "verifier_uses_safe_labels"
    ],
    "claim_types": [
      "causal",
      "feasibility",
      "mechanistic",
      "performance",
      "safety"
    ],
    "claims_sha256": "157be28bcd1ff7d3c3732be0a24f3ab3eea8075c91faa78058dfa3a70374daab",
    "pinned_at": "2026-08-01T05:05:24.805502Z",
    "required_artifact_ids": [
      "asd040_artifact_manifest",
      "asd040_state",
      "branch_decision",
      "experiment_plan",
      "final_claims",
      "final_result",
      "final_summary",
      "frozen_feature_registry",
      "input_validation_report",
      "locked_lineage_manifest",
      "locked_parent_checkpoint",
      "oracle_report",
      "protocol_config",
      "revision_2_logit_source_projection",
      "set_verifier_source_package",
      "set_verifier_test_suite",
      "val80_manifest",
      "val80_persistence_forest"
    ],
    "static_artifact_ids": [
      "experiment_plan",
      "locked_parent_checkpoint",
      "protocol_config"
    ]
  },
  "outcome": null,
  "phase": "implement_persistence_set_pipeline",
  "plan_history": [
    {
      "archived_artifacts_path": "experiments_aiselfdrive/.runtime/replans/asd_060_persistence_tree_set_verifier/revision_1_f73e7603278e/artifacts/manifest.json",
      "archived_claims_path": "experiments_aiselfdrive/.runtime/replans/asd_060_persistence_tree_set_verifier/revision_1_f73e7603278e/claims.yaml",
      "archived_plan_path": "experiments_aiselfdrive/.runtime/replans/asd_060_persistence_tree_set_verifier/revision_1_f73e7603278e/experiment.yaml",
      "archived_plan_sha256": "f73e7603278e1281730fddb303e58805ff019cd1edcd270975fe6380446d10a2",
      "archived_plan_size_bytes": 29781,
      "archived_result_path": "experiments_aiselfdrive/.runtime/replans/asd_060_persistence_tree_set_verifier/revision_1_f73e7603278e/result.json",
      "archived_result_sha256": "d631b3be6a2af0a3c791c3ac05f54c61b094641168db5efb0def152b1653debc",
      "archived_result_size_bytes": 775,
      "archived_state_path": "experiments_aiselfdrive/.runtime/replans/asd_060_persistence_tree_set_verifier/revision_1_f73e7603278e/state.json",
      "archived_state_sha256": "bd0d379982bb63ce3c3024c09f0778f515030bf9264c1ae930fdcba134b5da8a",
      "archived_state_size_bytes": 2546,
      "carried_budget_consumed": {
        "cpu_hours": 0.0,
        "gpu_hours": 0.0,
        "storage_gib": 0.0
      },
      "current_artifacts_sha256": "65adaa0eb969f904f99bb08175af479a530fdb822f7253974cf14e1873e673c8",
      "current_claims_sha256": "4ef02f3a4f1295d608806253655397ef5b0282dc861cb391fb043efb2867cd8c",
      "plan_revision": 1,
      "plan_sha256": "f73e7603278e1281730fddb303e58805ff019cd1edcd270975fe6380446d10a2",
      "previous_artifacts_sha256": "a4dff278529d946af8c74b13544c3222482bd76f71af3bc1e193a6630c01111c",
      "previous_artifacts_size_bytes": 9677,
      "previous_budget_consumed": {
        "cpu_hours": 0.0,
        "gpu_hours": 0.0,
        "storage_gib": 0.0
      },
      "previous_claims_sha256": "10c7e8f8646d3836fa45d646f45c735315c7f84eba7360d91bff45536d57093a",
      "previous_claims_size_bytes": 2064,
      "previous_plan_source": "git:827f962c3cfee117b6442b74653c752ed36f296c:experiments_aiselfdrive/experiments/asd_060_persistence_tree_set_verifier/experiment.yaml",
      "replanned_at": "2026-08-01T05:05:26.944311Z"
    }
  ],
  "plan_revision": 2,
  "plan_sha256": "c602b3acdceb27f90e004b1a9146b80629b693b9d61fbb161b7cafc1389d0a48",
  "revision": 1,
  "schema_version": "1.0",
  "stages": [
    {
      "attempts": 0,
      "completed_at": null,
      "evidence_refs": [],
      "id": "implement_persistence_set_pipeline",
      "last_error": null,
      "retry_not_before": null,
      "started_at": null,
      "status": "blocked"
    },
    {
      "attempts": 0,
      "completed_at": null,
      "evidence_refs": [],
      "id": "validate_locked_inputs",
      "last_error": null,
      "retry_not_before": null,
      "started_at": null,
      "status": "pending"
    },
    {
      "attempts": 0,
      "completed_at": null,
      "evidence_refs": [],
      "id": "build_val80_oracle",
      "last_error": null,
      "retry_not_before": null,
      "started_at": null,
      "status": "pending"
    },
    {
      "attempts": 0,
      "completed_at": null,
      "evidence_refs": [],
      "id": "resolve_tri_state_branch",
      "last_error": null,
      "retry_not_before": null,
      "started_at": null,
      "status": "pending"
    },
    {
      "attempts": 0,
      "completed_at": null,
      "evidence_refs": [],
      "id": "docker_gpu_preflight",
      "last_error": null,
      "retry_not_before": null,
      "started_at": null,
      "status": "pending"
    },
    {
      "attempts": 0,
      "completed_at": null,
      "evidence_refs": [],
      "id": "build_training_set_dataset",
      "last_error": null,
      "retry_not_before": null,
      "started_at": null,
      "status": "pending"
    },
    {
      "attempts": 0,
      "completed_at": null,
      "evidence_refs": [],
      "id": "t1_resume_smoke",
      "last_error": null,
      "retry_not_before": null,
      "started_at": null,
      "status": "pending"
    },
    {
      "attempts": 0,
      "completed_at": null,
      "evidence_refs": [],
      "id": "pilot_t2",
      "last_error": null,
      "retry_not_before": null,
      "started_at": null,
      "status": "pending"
    },
    {
      "attempts": 0,
      "completed_at": null,
      "evidence_refs": [],
      "id": "decision_t3",
      "last_error": null,
      "retry_not_before": null,
      "started_at": null,
      "status": "pending"
    },
    {
      "attempts": 0,
      "completed_at": null,
      "evidence_refs": [],
      "id": "confirm_t4",
      "last_error": null,
      "retry_not_before": null,
      "started_at": null,
      "status": "pending"
    },
    {
      "attempts": 0,
      "completed_at": null,
      "evidence_refs": [],
      "id": "closeout",
      "last_error": null,
      "retry_not_before": null,
      "started_at": null,
      "status": "pending"
    }
  ],
  "status": "blocked",
  "updated_at": "2026-08-01T05:05:26.945079Z",
  "verified_artifact_ids": [
    "experiment_plan",
    "locked_parent_checkpoint",
    "protocol_config"
  ]
}
