{
  "artifacts_verified": false,
  "blockers": [
    {
      "code": "dependency_unsatisfied",
      "message": "asd_000_evidence_lock_error_atlas: dependency status is ready",
      "stage_id": "implement_factorial_binding_pipeline"
    }
  ],
  "budget_consumed": {
    "cpu_hours": 0.0,
    "gpu_hours": 0.0,
    "storage_gib": 0.0
  },
  "closeout_passed": false,
  "created_at": "2026-07-31T00:00:00Z",
  "current_stage_id": null,
  "executor": null,
  "experiment_id": "asd_020_factorial_pathology_anatomy_binding",
  "last_event_seq": 2,
  "lease": null,
  "obligation_projection": {
    "artifact_ids": [
      "anatomical_cot",
      "closeout_report",
      "corpus_audit",
      "corpus_exclusions",
      "factorial_source_package",
      "factorial_test_suite",
      "feature_export_audit",
      "frozen_feature_manifest",
      "frozen_features",
      "gpu_preflight_report",
      "human_summary",
      "locked_embedding_bank",
      "locked_lineage",
      "official_metadata",
      "probe_checkpoints",
      "probe_metrics",
      "probe_report",
      "probe_summary",
      "promotion_record",
      "protocol_config",
      "quartet_corpus",
      "qwen_snapshot",
      "qwen_snapshot_manifest",
      "qwen_snapshot_report",
      "s3_checkpoint",
      "standard_checkpoint",
      "t1_checkpoint",
      "t1_report",
      "t2_checkpoints",
      "t2_metrics",
      "t2_report",
      "t3_checkpoints",
      "t3_metrics",
      "t3_report",
      "t4_disabled_residual_checkpoint",
      "t4_disabled_residual_metrics",
      "t4_factorial_residual_checkpoint",
      "t4_factorial_residual_metrics",
      "t4_metrics",
      "t4_report",
      "val120_manifest",
      "val200_manifest",
      "val80_manifest"
    ],
    "artifacts_sha256": "11b9150629cdff1f611d8b51378258cae634ef33b6fe94c41763068330aeee32",
    "claim_ids": [
      "factorial_binding_pipeline_feasible",
      "factorial_binding_signal_exists",
      "factorial_task_and_residual_are_safe",
      "interaction_residual_improves_val80",
      "interaction_residual_replicates_on_internal_val120",
      "learned_interaction_causes_joint_margin"
    ],
    "claim_types": [
      "causal",
      "feasibility",
      "mechanistic",
      "performance",
      "safety"
    ],
    "claims_sha256": "7ff758ae74b98938697893bae185a3f34821136c09fe212139671bfafe18ff41",
    "pinned_at": "2026-08-01T05:04:46.379294Z",
    "required_artifact_ids": [
      "anatomical_cot",
      "closeout_report",
      "corpus_audit",
      "corpus_exclusions",
      "factorial_source_package",
      "factorial_test_suite",
      "feature_export_audit",
      "frozen_feature_manifest",
      "frozen_features",
      "gpu_preflight_report",
      "human_summary",
      "locked_embedding_bank",
      "locked_lineage",
      "official_metadata",
      "probe_checkpoints",
      "probe_metrics",
      "probe_report",
      "probe_summary",
      "protocol_config",
      "quartet_corpus",
      "qwen_snapshot",
      "qwen_snapshot_manifest",
      "qwen_snapshot_report",
      "s3_checkpoint",
      "standard_checkpoint",
      "t1_checkpoint",
      "t1_report",
      "t2_checkpoints",
      "t2_metrics",
      "t2_report",
      "t3_checkpoints",
      "t3_metrics",
      "t3_report",
      "val80_manifest"
    ],
    "static_artifact_ids": [
      "anatomical_cot",
      "locked_embedding_bank",
      "official_metadata",
      "s3_checkpoint",
      "standard_checkpoint"
    ]
  },
  "outcome": null,
  "phase": "implement_factorial_binding_pipeline",
  "plan_history": [
    {
      "archived_artifacts_path": "experiments_aiselfdrive/.runtime/replans/asd_020_factorial_pathology_anatomy_binding/revision_1_62fd0c6adc98/artifacts/manifest.json",
      "archived_claims_path": "experiments_aiselfdrive/.runtime/replans/asd_020_factorial_pathology_anatomy_binding/revision_1_62fd0c6adc98/claims.yaml",
      "archived_plan_path": "experiments_aiselfdrive/.runtime/replans/asd_020_factorial_pathology_anatomy_binding/revision_1_62fd0c6adc98/experiment.yaml",
      "archived_plan_sha256": "62fd0c6adc987dd2dc46a21ef663e487e7c623602343801dea62fcc476244e78",
      "archived_plan_size_bytes": 32966,
      "archived_result_path": "experiments_aiselfdrive/.runtime/replans/asd_020_factorial_pathology_anatomy_binding/revision_1_62fd0c6adc98/result.json",
      "archived_result_sha256": "9f4728e297b51905881df88ddc3cd7381606467de99a6be971652875028a6b1e",
      "archived_result_size_bytes": 458,
      "archived_state_path": "experiments_aiselfdrive/.runtime/replans/asd_020_factorial_pathology_anatomy_binding/revision_1_62fd0c6adc98/state.json",
      "archived_state_sha256": "8d58917da81259ae2dd0413e64aa14ef1bc32648a3c209e1899e62b0558a7484",
      "archived_state_size_bytes": 2135,
      "carried_budget_consumed": {
        "cpu_hours": 0.0,
        "gpu_hours": 0.0,
        "storage_gib": 0.0
      },
      "current_artifacts_sha256": "743a117d725ef4e1154b3a3a5c96de98af063c10ca70dbf1cab2f1163f8ce97c",
      "current_claims_sha256": "55d5cb1def94b5dab8c1e893b7652f7f6079dcb7935b18d9aca943d0818f2a38",
      "plan_revision": 1,
      "plan_sha256": "62fd0c6adc987dd2dc46a21ef663e487e7c623602343801dea62fcc476244e78",
      "previous_artifacts_sha256": "4729a86ce1601cf314521191c97e002f292ea10a7ee8a26ab31cb5bf89dbb90e",
      "previous_artifacts_size_bytes": 3280,
      "previous_budget_consumed": {
        "cpu_hours": 0.0,
        "gpu_hours": 0.0,
        "storage_gib": 0.0
      },
      "previous_claims_sha256": "a45b7b36dddf6da79e67a4ce35ca5af9421c4852160a7dfd75312deadb4bcc13",
      "previous_claims_size_bytes": 1840,
      "previous_plan_source": "git:827f962c3cfee117b6442b74653c752ed36f296c:experiments_aiselfdrive/experiments/asd_020_factorial_pathology_anatomy_binding/experiment.yaml",
      "replanned_at": "2026-08-01T05:04:50.604993Z"
    }
  ],
  "plan_revision": 2,
  "plan_sha256": "2a1aeb930380dd9fef6111d2649bb75eed464c429b16bc3e23fe9106c05615e4",
  "revision": 1,
  "schema_version": "1.0",
  "stages": [
    {
      "attempts": 0,
      "completed_at": null,
      "evidence_refs": [],
      "id": "implement_factorial_binding_pipeline",
      "last_error": null,
      "retry_not_before": null,
      "started_at": null,
      "status": "blocked"
    },
    {
      "attempts": 0,
      "completed_at": null,
      "evidence_refs": [],
      "id": "lock_train_factorial_corpus",
      "last_error": null,
      "retry_not_before": null,
      "started_at": null,
      "status": "pending"
    },
    {
      "attempts": 0,
      "completed_at": null,
      "evidence_refs": [],
      "id": "materialize_qwen_snapshot",
      "last_error": null,
      "retry_not_before": null,
      "started_at": null,
      "status": "pending"
    },
    {
      "attempts": 0,
      "completed_at": null,
      "evidence_refs": [],
      "id": "docker_gpu_preflight",
      "last_error": null,
      "retry_not_before": null,
      "started_at": null,
      "status": "pending"
    },
    {
      "attempts": 0,
      "completed_at": null,
      "evidence_refs": [],
      "id": "export_frozen_text_and_region_features",
      "last_error": null,
      "retry_not_before": null,
      "started_at": null,
      "status": "pending"
    },
    {
      "attempts": 0,
      "completed_at": null,
      "evidence_refs": [],
      "id": "train_and_gate_factorial_probes",
      "last_error": null,
      "retry_not_before": null,
      "started_at": null,
      "status": "pending"
    },
    {
      "attempts": 0,
      "completed_at": null,
      "evidence_refs": [],
      "id": "t1_zero_residual_smoke",
      "last_error": null,
      "retry_not_before": null,
      "started_at": null,
      "status": "pending"
    },
    {
      "attempts": 0,
      "completed_at": null,
      "evidence_refs": [],
      "id": "t2_500_update_val80",
      "last_error": null,
      "retry_not_before": null,
      "started_at": null,
      "status": "pending"
    },
    {
      "attempts": 0,
      "completed_at": null,
      "evidence_refs": [],
      "id": "t3_2000_update_val80",
      "last_error": null,
      "retry_not_before": null,
      "started_at": null,
      "status": "pending"
    },
    {
      "attempts": 0,
      "completed_at": null,
      "evidence_refs": [],
      "id": "t4_confirmatory_binding",
      "last_error": null,
      "retry_not_before": null,
      "started_at": null,
      "status": "pending"
    },
    {
      "attempts": 0,
      "completed_at": null,
      "evidence_refs": [],
      "id": "closeout_factorial_binding",
      "last_error": null,
      "retry_not_before": null,
      "started_at": null,
      "status": "pending"
    }
  ],
  "status": "blocked",
  "updated_at": "2026-08-01T05:04:50.605768Z",
  "verified_artifact_ids": [
    "anatomical_cot",
    "locked_embedding_bank",
    "official_metadata",
    "s3_checkpoint",
    "standard_checkpoint"
  ]
}
