{
  "schema_version": "1.0",
  "experiment_id": "__EXPERIMENT_ID__",
  "plan_sha256": "__PLAN_SHA256__",
  "plan_revision": 1,
  "revision": 0,
  "status": "draft",
  "outcome": null,
  "created_at": "1970-01-01T00:00:00Z",
  "updated_at": "1970-01-01T00:00:00Z",
  "current_stage_id": "implement",
  "executor": null,
  "blockers": [],
  "stages": [
    {
      "id": "implement",
      "status": "ready",
      "attempts": 0,
      "started_at": null,
      "completed_at": null,
      "last_error": null,
      "evidence_refs": []
    }
  ],
  "artifacts_verified": false,
  "closeout_passed": false
}
